{
  "registry_type": "source-dataset-registry",
  "schema_version": "1.0",
  "updated_at": "2026-08-02",
  "sources": [
    {
      "dataset_id": "cyclonedx-bom-examples",
      "root_id": "cyclonedx-bom-examples@7d9172d00c88c05a8f1ccb90589d111870fc9d86",
      "name": "CycloneDX BOM Examples",
      "source_type": "git",
      "upstream_url": "https://github.com/CycloneDX/bom-examples.git",
      "lineage_group": "cyclonedx-bom-examples",
      "pin": {
        "ref_type": "commit",
        "ref_name": "7d9172d00c88c05a8f1ccb90589d111870fc9d86",
        "resolved_commit": "7d9172d00c88c05a8f1ccb90589d111870fc9d86",
        "tag_object": null,
        "acquisition_artifact_sha256": "bc3807d58eeba158e8484f31d2b444f62fcb8cc4e38355291a1026f43e1c5147"
      },
      "license": {
        "expression": "CC0-1.0",
        "review_status": "PRELIMINARY_LICENSE_IDENTIFIED",
        "evidence_paths": ["LICENSE"],
        "evidence_hashes": {"LICENSE": "a2010f343487d3f7618affe54f789f5487602331c0a8d03f49e9a7c547cf0499"},
        "content_scopes": [
          {"scope": "repository", "expression": "CC0-1.0", "training_allowed": false, "raw_redistribution_allowed": true}
        ]
      },
      "governance": {
        "admission_status": "QUARANTINE_ACQUIRED",
        "purposes": ["FORMAT_EXAMPLES", "PUBLIC_REGRESSION_CANDIDATE"],
        "split": "PUBLIC_REGRESSION",
        "acquisition_allowed": true,
        "internal_development_allowed": false,
        "training_allowed": false,
        "evaluation_allowed": false,
        "fixture_distribution_allowed": false,
        "raw_redistribution_allowed": false,
        "adapter_distribution_allowed": false,
        "weight_distribution_allowed": false,
        "redistribution_status": "NOT_APPROVED_PENDING_NAMED_RIGHTS_REVIEW",
        "access_terms_status": "PUBLIC_GITHUB_TERMS_NOT_FROZEN",
        "tdm_reservation_status": "NOT_ASSESSED_NOT_USED_FOR_TRAINING",
        "submodules_status": "FORBIDDEN_NOT_ACQUIRED",
        "lfs_status": "FORBIDDEN_NOT_ACQUIRED",
        "generated_content_status": "NOT_ASSESSED",
        "binary_content_status": "NOT_ASSESSED",
        "attribution_status": "SOURCE_AND_COMMIT_RETAINED",
        "acquisition_status": "FROZEN_VERIFIED_TECHNICAL",
        "rights_status": "AWAITING_NAMED_REVIEW",
        "usage_status": "NOT_ADMITTED",
        "format_validation_status": "NOT_ASSESSED",
        "release_status": "NOT_APPROVED",
        "rights_decision_ref": null,
        "rights_decision_sha256": null,
        "revalidation_triggers": ["SOURCE_VERSION_CHANGE", "LICENSE_CHANGE", "USAGE_SCOPE_CHANGE"],
        "shipping_examples_allowed": false
      },
      "acquisition": {
        "allow_submodules": false,
        "execute_code": false,
        "max_files": 5000,
        "max_total_bytes": 250000000
      },
      "notes": "格式与 round-trip 正例；不得作为组件完整性真值。"
    },
    {
      "dataset_id": "cyclonedx-specification-1.7",
      "root_id": "cyclonedx-specification-1.7@4b3f59453366e27c8073fd24e98bf21ef8892c8e",
      "name": "CycloneDX Specification 1.7",
      "source_type": "git",
      "upstream_url": "https://github.com/CycloneDX/specification.git",
      "lineage_group": "cyclonedx-specification",
      "pin": {
        "ref_type": "commit",
        "ref_name": "1.7",
        "resolved_commit": "4b3f59453366e27c8073fd24e98bf21ef8892c8e",
        "tag_object": null,
        "acquisition_artifact_sha256": null
      },
      "license": {
        "expression": "Apache-2.0",
        "review_status": "PENDING_NAMED_REVIEW",
        "evidence_paths": ["LICENSE"],
        "evidence_hashes": {"LICENSE": null},
        "content_scopes": [
          {"scope": "repository", "expression": "Apache-2.0", "training_allowed": false, "raw_redistribution_allowed": true}
        ]
      },
      "governance": {
        "admission_status": "REGISTERED_PENDING_REVIEW",
        "purposes": ["FORMAT_SCHEMA_CANDIDATE", "SCHEMA_VALIDATION_CANDIDATE"],
        "split": "PUBLIC_REGRESSION",
        "acquisition_allowed": true,
        "internal_development_allowed": false,
        "training_allowed": false,
        "evaluation_allowed": false,
        "fixture_distribution_allowed": false,
        "raw_redistribution_allowed": false,
        "adapter_distribution_allowed": false,
        "weight_distribution_allowed": false,
        "redistribution_status": "CONDITIONAL_APACHE_NOTICE",
        "access_terms_status": "PUBLIC_GITHUB_TERMS_NOT_FROZEN",
        "tdm_reservation_status": "NOT_ASSESSED_NOT_USED_FOR_TRAINING",
        "submodules_status": "FORBIDDEN_NOT_ACQUIRED",
        "lfs_status": "FORBIDDEN_NOT_ACQUIRED",
        "generated_content_status": "NOT_ASSESSED",
        "binary_content_status": "NOT_ASSESSED",
        "attribution_status": "APACHE_NOTICE_REQUIRED",
        "acquisition_status": "REGISTERED_PENDING_ACQUISITION",
        "rights_status": "AWAITING_LICENSE_EVIDENCE",
        "usage_status": "NOT_ADMITTED",
        "format_validation_status": "NOT_ASSESSED",
        "release_status": "NOT_APPROVED",
        "rights_decision_ref": null,
        "rights_decision_sha256": null,
        "revalidation_triggers": ["SOURCE_VERSION_CHANGE", "LICENSE_CHANGE", "USAGE_SCOPE_CHANGE"],
        "shipping_examples_allowed": false
      },
      "acquisition": {
        "allow_submodules": false,
        "execute_code": false,
        "max_files": 10000,
        "max_total_bytes": 250000000
      },
      "notes": "绑定 1.7 schema；schema PASS 不证明组件或关系真实。"
    },
    {
      "dataset_id": "spdx-examples",
      "root_id": "spdx-examples@2181917ef6ff74de89252ee785583c27a38d6199",
      "name": "SPDX Examples",
      "source_type": "git",
      "upstream_url": "https://github.com/spdx/spdx-examples.git",
      "lineage_group": "spdx-examples",
      "pin": {
        "ref_type": "commit",
        "ref_name": "2181917ef6ff74de89252ee785583c27a38d6199",
        "resolved_commit": "2181917ef6ff74de89252ee785583c27a38d6199",
        "tag_object": null,
        "acquisition_artifact_sha256": null
      },
      "license": {
        "expression": "MIXED: GPL-3.0-or-later AND CC-BY-4.0 AND per-file exceptions",
        "review_status": "LEGAL_REVIEW_REQUIRED",
        "evidence_paths": ["README.md", "COPYING"],
        "evidence_hashes": {"README.md": null, "COPYING": null},
        "content_scopes": [
          {"scope": "source-code-unless-overridden", "expression": "GPL-3.0-or-later", "training_allowed": false, "raw_redistribution_allowed": false},
          {"scope": "documentation", "expression": "CC-BY-4.0", "training_allowed": false, "raw_redistribution_allowed": false},
          {"scope": "spdx-documents", "expression": "CC0-1.0", "training_allowed": false, "raw_redistribution_allowed": true}
        ]
      },
      "governance": {
        "admission_status": "REGISTERED_PENDING_REVIEW",
        "purposes": ["CURATED_PAIR", "FORMAT_REGRESSION"],
        "split": "PUBLIC_REGRESSION",
        "acquisition_allowed": true,
        "internal_development_allowed": false,
        "training_allowed": false,
        "evaluation_allowed": false,
        "fixture_distribution_allowed": false,
        "raw_redistribution_allowed": false,
        "adapter_distribution_allowed": false,
        "weight_distribution_allowed": false,
        "redistribution_status": "BLOCKED_PENDING_PER_SCOPE_SELECTION",
        "access_terms_status": "PUBLIC_GITHUB_TERMS_NOT_FROZEN",
        "tdm_reservation_status": "NOT_ASSESSED_NOT_USED_FOR_TRAINING",
        "submodules_status": "FORBIDDEN_NOT_ACQUIRED",
        "lfs_status": "FORBIDDEN_NOT_ACQUIRED",
        "generated_content_status": "NOT_ASSESSED",
        "binary_content_status": "NOT_ASSESSED",
        "attribution_status": "PER_SCOPE_OBLIGATIONS_REQUIRED",
        "acquisition_status": "REGISTERED_PENDING_ACQUISITION",
        "rights_status": "AWAITING_LICENSE_EVIDENCE",
        "usage_status": "NOT_ADMITTED",
        "format_validation_status": "NOT_ASSESSED",
        "release_status": "NOT_APPROVED",
        "rights_decision_ref": null,
        "rights_decision_sha256": null,
        "revalidation_triggers": ["SOURCE_VERSION_CHANGE", "LICENSE_CHANGE", "CONTENT_SCOPE_CHANGE"],
        "shipping_examples_allowed": false
      },
      "acquisition": {
        "allow_submodules": false,
        "execute_code": false,
        "max_files": 20000,
        "max_total_bytes": 500000000
      },
      "notes": "可隔离用于 source/binary/SBOM 配对验证；逐文件许可后方可再分发。"
    },
    {
      "dataset_id": "openembedded-core-yocto-6.0.2",
      "root_id": "openembedded-core-yocto-6.0.2@5d1aa5c806c061a2994f4decb59016610f093213",
      "name": "OpenEmbedded Core Yocto 6.0.2",
      "source_type": "git",
      "upstream_url": "https://git.openembedded.org/openembedded-core",
      "lineage_group": "openembedded-core",
      "pin": {
        "ref_type": "annotated_tag",
        "ref_name": "yocto-6.0.2",
        "resolved_commit": "5d1aa5c806c061a2994f4decb59016610f093213",
        "tag_object": "8ecd6056805602dc99c4cd110b04e39ae5424610",
        "acquisition_artifact_sha256": null
      },
      "license": {
        "expression": "MIXED_FILE_AND_RECIPE_LEVEL",
        "review_status": "ACQUIRE_ONLY_RECIPE_REVIEW_REQUIRED",
        "evidence_paths": ["LICENSE"],
        "evidence_hashes": {"LICENSE": null},
        "content_scopes": [
          {"scope": "metadata-default", "expression": "MIT", "training_allowed": false, "raw_redistribution_allowed": false},
          {"scope": "otherwise-unspecified-files", "expression": "GPL-2.0-only", "training_allowed": false, "raw_redistribution_allowed": false},
          {"scope": "recipe-sources-and-patches", "expression": "PER_RECIPE", "training_allowed": false, "raw_redistribution_allowed": false}
        ]
      },
      "governance": {
        "admission_status": "REGISTERED_PENDING_REVIEW",
        "purposes": ["DEV_BUILD_YOCTO", "BUILD_REFERENCE"],
        "split": "DEV_BUILD_YOCTO",